{
  "$schema": "https://json-schema.org/draft/2020-12/schema",
  "$id": "https://socioprophet.github.io/sociosphere/protocol/workspace-fabric/v0/tombstone-decision.schema.json",
  "title": "MountTombstoneDecision",
  "type": "object",
  "additionalProperties": false,
  "required": [
    "api_version",
    "kind",
    "workspace_ref",
    "mount_ref",
    "signed_tombstone",
    "local_dirty",
    "decision_status",
    "resulting_state",
    "policy_bundle_ref",
    "correlation_id"
  ],
  "properties": {
    "api_version": {"const": "sourceos.fabric.mount/v0.1"},
    "kind": {"const": "MountTombstoneDecision"},
    "workspace_ref": {"type": "string", "minLength": 1},
    "mount_ref": {"type": "string", "minLength": 1},
    "signed_tombstone": {"type": "boolean"},
    "local_dirty": {"type": "boolean"},
    "decision_status": {"enum": ["applied", "rejected", "manual_reconcile_required"]},
    "resulting_state": {"enum": ["TOMBSTONED", "ACTIVE", "RECONCILE_REQUIRED"]},
    "policy_bundle_ref": {"type": "string", "minLength": 1},
    "correlation_id": {"type": "string", "minLength": 1}
  }
}
